{"schema_version":"1.0","ok":true,"data":{"source_categories":14606,"statuses":{"mapped-single":14528,"explicit-upstream-unmapped":78},"dispositions":[{"source_id":"aa","status":"mapped-single","target_ids":["166"],"reason":"validated-forward-rule"},{"source_id":"aa-1","status":"mapped-single","target_ids":["1604"],"reason":"validated-forward-rule"},{"source_id":"aa-1-1","status":"mapped-single","target_ids":["5322"],"reason":"validated-forward-rule"}],"next_offset":3,"crosswalk_sha256":"93a223a7ac687a78a0a1151d6e763d3dcfe43d4100cc0f225a2c30672e577903"},"warnings":[],"error":null,"completeness":"complete"}
