{"schema_version":"1.0","ok":true,"data":{"manifest":{"schema_version":1,"namespace":"google:product_category","version":"2021-09-21","locale":"en-US","source_url":"https://raw.githubusercontent.com/Shopify/product-taxonomy/2e9aa2e9b882383952c63d212add13eb80f46cf9/data/integrations/google/2021-09-21/full_names.yml","source_sha256":"30039729880ec5ac4851de088ad228a6898aa253f0de5d5ebea5bb1437478fce","fingerprint":"3b6a52f1d3512c813109844031e0b7e16574ca39c00a60eee02d0d992321323c","counts":{"categories":5595,"roots":21,"leaves":4719,"parent_links":5574},"source_kind":"shopify_google_snapshot","source_provenance":{"source_kind":"shopify_google_snapshot","source_url":"https://raw.githubusercontent.com/Shopify/product-taxonomy/2e9aa2e9b882383952c63d212add13eb80f46cf9/data/integrations/google/2021-09-21/full_names.yml","source_commit":"2e9aa2e9b882383952c63d212add13eb80f46cf9","source_sha256":"4b6fcdaf79f501a4f5cef9d35b95749b021c0cff48baeb3fd8be6733d1e9bee6","derived_sha256":"30039729880ec5ac4851de088ad228a6898aa253f0de5d5ebea5bb1437478fce"},"catalog_sha256":"3b6a52f1d3512c813109844031e0b7e16574ca39c00a60eee02d0d992321323c"},"resource_route":"operator-provisioned"},"warnings":[],"error":null,"completeness":"complete"}
